{
  "schema": "agent-memory-staging-retrieval-load-input-v1",
  "classification": "staging_external",
  "environment": "staging",
  "run_id": "replace-with-load-run-id",
  "workload_version": "replace-with-workload-version",
  "deployment_site_version": "replace-with-site-version",
  "model_route_version": "replace-with-route-version",
  "target_version": "replace-with-target-version",
  "inventory_id": "replace-with-inventory-id",
  "inventory_receipt_sha256": "aaaaaaaaaaaaaaaaaaaaaaaaaaaaaaaaaaaaaaaaaaaaaaaaaaaaaaaaaaaaaaaa",
  "plan_id": "replace-with-plan-id",
  "plan_receipt_sha256": "bbbbbbbbbbbbbbbbbbbbbbbbbbbbbbbbbbbbbbbbbbbbbbbbbbbbbbbbbbbbbbbb",
  "change_id": "replace-with-change-id",
  "change_receipt_sha256": "cccccccccccccccccccccccccccccccccccccccccccccccccccccccccccccccc",
  "release_id": "replace-with-release-id",
  "release_receipt_sha256": "dddddddddddddddddddddddddddddddddddddddddddddddddddddddddddddddd",
  "workload_manifest_sha256": "eeeeeeeeeeeeeeeeeeeeeeeeeeeeeeeeeeeeeeeeeeeeeeeeeeeeeeeeeeeeeeee",
  "load_report_sha256": "ffffffffffffffffffffffffffffffffffffffffffffffffffffffffffffffff",
  "model_cost_report_sha256": "1111111111111111111111111111111111111111111111111111111111111111",
  "target_decision_sha256": "2222222222222222222222222222222222222222222222222222222222222222",
  "target_approved_at": "2026-08-10T07:00:00Z",
  "run_started_at": "2026-08-10T08:00:00Z",
  "run_completed_at": "2026-08-10T09:00:00Z",
  "generated_at": "2026-08-10T09:15:00Z",
  "corpus_source_count": 100,
  "corpus_passage_count": 20000,
  "request_count": 5000,
  "concurrency": 32,
  "error_count": 0,
  "model_call_count": 5000,
  "p50_latency_microseconds": 110000,
  "p95_latency_microseconds": 620000,
  "p99_latency_microseconds": 760000,
  "maximum_model_cost_microusd_per_1000_requests": 250000,
  "observed_model_cost_microusd_per_1000_requests": 180000,
  "ready": true,
  "checks": [
    {"id": "representative_corpus_verified", "outcome": "passed", "evidence_sha256": "3333333333333333333333333333333333333333333333333333333333333333"},
    {"id": "deployed_site_verified", "outcome": "passed", "evidence_sha256": "4444444444444444444444444444444444444444444444444444444444444444"},
    {"id": "approved_model_route_exercised", "outcome": "passed", "evidence_sha256": "5555555555555555555555555555555555555555555555555555555555555555"},
    {"id": "concurrency_profile_completed", "outcome": "passed", "evidence_sha256": "6666666666666666666666666666666666666666666666666666666666666666"},
    {"id": "latency_distribution_complete", "outcome": "passed", "evidence_sha256": "7777777777777777777777777777777777777777777777777777777777777777"},
    {"id": "search_p95_target_met", "outcome": "passed", "evidence_sha256": "8888888888888888888888888888888888888888888888888888888888888888"},
    {"id": "model_cost_attribution_complete", "outcome": "passed", "evidence_sha256": "9999999999999999999999999999999999999999999999999999999999999999"},
    {"id": "model_cost_target_met", "outcome": "passed", "evidence_sha256": "0000000000000000000000000000000000000000000000000000000000000000"}
  ]
}
